title,num_comments,spoiler,over_18,created_utc,score
"People who’ve lost a significant amount of weight, how did the way people treat you change? How did you feel about the change?",5,False,False,1573668505.0,2
What hacks did you decide to try out in your social life that ended up working?,2,False,False,1573668477.0,5
How did you find/learn about your favorite song?,4,False,False,1573668461.0,4
People who have discovered traumatic repressed memories - What were they?,8,False,False,1573668450.0,3
"Children of divorce of Reddit, what do you think about your parents splitting up?",11,False,False,1573668449.0,5
What’s the most unusual thing you’ve heard coming from a bathroom stall?,3,False,False,1573668449.0,4
How many rats would it take to move a sleigh?,9,False,False,1573668442.0,3
"Guys of reddit: When peeing at a urinal, balls in or out?",13,False,False,1573668441.0,6
The internet got Paramount to change the weird Sonic design. How else has the internet won?,5,False,False,1573668440.0,2
Does a Belief in Free Will make you more or less happy? Why?,3,False,False,1573668434.0,2
"If you could be famous, what would you want to be famous for?",4,False,False,1573668433.0,2
What is the best video game of this decade?,16,False,False,1573668420.0,5
Which is better Crystal Geyser or Aquafina?,14,False,False,1573668412.0,1
What's the funniest/weirdest thing you've done for charity?,5,False,False,1573668383.0,3
Whats the worst thing you've done in school?,8,False,False,1573668368.0,5
"In your opinion, what is wrong with our current world?",13,False,False,1573668367.0,6
"Which scam ended up benefiting you as the ""victim?""",3,False,False,1573668363.0,4
[serious] what helps you the most when dealing with anxiety?,5,False,False,1573668358.0,3
Why should one worry if some government secret service is spying on them through their phone and looking through their search history?,8,False,False,1573668341.0,1
What are the best Small Commentary Channels?,2,False,False,1573668336.0,3
How long did it take you or your SO to say “I love you”?,5,False,False,1573668308.0,2
What are possible medical solutions to extreme needle phobia in an autistic adult?,6,False,False,1573668297.0,2
You wake up in a completely different place and it looks like heaven...IT IS! Jesus comes to you and offers you a deal that you can be a goat for one day for a free bypass ticket to heaven. What do you ask him before leaving and answering your question?,4,False,False,1573668290.0,2
What brand lost you as a costumer?,16,False,False,1573668284.0,5
"What justification do we have for neutering young, innocent dogs as it’s obviously NOT better for the dog?",12,False,False,1573668252.0,0
What is something you think you’re below average at?,12,False,False,1573668247.0,2
What's the luckiest thing that's ever happened to you?,6,False,False,1573668239.0,6
What's some small talk to have with your captor when you're in a Vietnamese death camp?,5,False,False,1573668238.0,3
What's your worst experience with getting hacked/phished/scammed online?,3,False,False,1573668235.0,2
"People of reddit: What are your sort of ""demons"" or emotions (essentially) that you never like to show or expirence?",4,False,False,1573668225.0,2
What goals do you want to accomplish in the 2020’s that you don’t want to tell anyone about?,7,False,False,1573668214.0,0
Who are the most misunderstood people in history?,4,False,False,1573668213.0,3
What are the books that you MUST read before you die?,7,False,False,1573668188.0,4
What is the saddest song?,24,False,False,1573668164.0,4
What is your pet peeve people of reddit ?,7,False,False,1573668157.0,5
When is it possible for a lazer pointer to disrupt a security camera?,15,False,False,1573668156.0,1
What’s a good thought-provoking book?,14,False,False,1573668156.0,4
What is some juicy drama going on in your life right now?,13,False,False,1573668142.0,2
"Who is more likable, Fred or George (Harry Potter)? Zack or Cody (Disney Channel)? Annie or Hallie (The Parent Trap)? Why?",4,False,False,1573668140.0,2
what is something that makes you hopeful for mankind?,2,False,False,1573668127.0,2
"The Nazis pinned yellow stars of David to identify the Jews. When millennials take power, what should be pinned to Boomers to identify them in public?",16,False,False,1573668127.0,0
What does your diet consist of?,15,False,False,1573668125.0,4
You order at a restaurant but the chef reading the order has dyslexia. What does the waiter bring you?,6,False,False,1573668124.0,4
What would you do for $100?,14,False,False,1573668123.0,1
What are the things that you can do at work but not at home?,6,False,False,1573668116.0,2
What's your go-to song when you want to pump yourself up?,18,False,False,1573668107.0,6
"There’s only 1 month and 17 days until the end of the 2010 decade. What is the biggest thing that you have accomplished this decade, and what big thing do you want to happen in the next decade?",9,False,False,1573668106.0,3
"What do you do in your profession, and do you enjoy what you do?",11,False,False,1573668102.0,4
"Straight men of Reddit, what do you actually think when you notice another guy checking you out?",7,False,False,1573668090.0,2
What did you get away with?,5,False,False,1573668088.0,0
What do you think the RDA (recommended daily allowance) for eating white processed sugar cane actually is?,1,False,False,1573668087.0,0
"People of Reddit, what is something so dumb that shouldn't have worked but it instead did?",1,False,False,1573668086.0,2
You can never have to much what?,5,False,False,1573668084.0,2
What’s the deepest YouTube wormhole you’ve ever been on? Where did you start and where did you finish?,4,False,False,1573668077.0,4
"What is a good question for ""Never have I ever""?",14,False,False,1573668074.0,2
What is the name of your favorite pet?,4,False,False,1573668073.0,0
What was something your pet did that made you think they are smarter then they let on?,6,False,False,1573668068.0,3
You got a chance to travel whatever year you want. Where would you go past or future and why?,2,False,False,1573668067.0,2
What's the oldest item you own?,28,False,False,1573668053.0,1
What is the ultimate breakfast of champions?,10,False,False,1573668051.0,1
What was an obvious trap (or scam) you fell right into?,1,False,False,1573668049.0,1
what is your biggest phobia?,5,False,False,1573668043.0,1
"What screams ""I am a doormat?""",4,False,False,1573668039.0,1
"Gamers of Reddit, What is the hardest game you have ever played?",14,False,False,1573668037.0,1
"if mirrors had a browser history, what would you be immediately deleting? [NSFW]",6,False,True,1573668030.0,2
"Alpha males of Reddit, how do you deal with other alpha males?",18,False,False,1573668029.0,3
How do you feel about the separate black/white people twitter subreddits?,2,False,False,1573668023.0,0
What is the stupidest rule you had at school?,5,False,False,1573668019.0,0
"Disney Plus, What are your opinions?",7,False,False,1573668017.0,0
How many calories do you eat in an average day?,10,False,False,1573668009.0,1
"Guys, what do you think when you notice a girl checking you out?",7,False,False,1573668000.0,2
What was the last thing you searched in Google?,10,False,False,1573667990.0,3
Why are so few lazer pointers being used in the Hong Kong protest?,4,False,False,1573667987.0,2
What’s the craziest thing you would do for a dollar?,7,False,False,1573667967.0,1
It’s been 7 years since bo2 came out. What is your funny or nostalgic story from bo2?,7,False,False,1573667966.0,1
What is the kindest thing done by a villain of any universe?,4,False,False,1573667957.0,3
"So, how are going your 2019 new year resolutions?",2,False,False,1573667952.0,2
What is your favorite Jack Stauber song and why?,8,False,False,1573667947.0,2
What would be the most ridiculous song to include on a Kidz Bop album?,14,False,False,1573667940.0,6
"Boomers of reddit, what are your thoughts on the ""Ok, boomer"" meme?",8,False,False,1573667925.0,3
"Non-American Redditors, what's your opinion of the United States as a country at this point in time?",7,False,False,1573667920.0,1
What secrets are the government keeping from us?,8,False,False,1573667905.0,1
"Bald people, how often does the teasing happen and annoy you?",6,False,False,1573667902.0,1
What do you always put off until last minute?,10,False,False,1573667896.0,2
What anime character metaphorically sums up your life/situation right now?,8,False,False,1573667891.0,1
What is your go-to website when you are bored besides reddit?,5,False,False,1573667882.0,4
What is the best condimentless sandwich?,7,False,False,1573667882.0,2
"If you could have anything in the world, only one thing, what would it be?",9,False,False,1573667878.0,1
"Some one knows which is the better way, or the right order for connect a laptop and it's charger?",1,False,False,1573667869.0,1
Redditors who give awards to reddit's awards post (ad). Why?,1,False,False,1573667859.0,1
What did the unpopular kid at your school do that made them popular?,3,False,False,1573667858.0,1
What's your sex song?,18,False,True,1573667847.0,5
Why is everything shit?,14,False,False,1573667844.0,1
"Teachers(and not only), what are the stupidest pupils you've met?",2,False,False,1573667841.0,2
"It's the year 3000, how do you imagine the world to be now?",9,False,False,1573667840.0,3
What do you do to get over heartbreak from a bad breakup/divorce?,3,False,False,1573667834.0,1
"Elders of reddit, what advice do you bid to younger generations?",7,False,False,1573667828.0,2
[Serious] What are 2 things that you're passionate about?,9,False,False,1573667826.0,2
Where is the weirdest place you have witnessed a marriage proposal?,3,False,False,1573667824.0,1
"What's the moment that made you say :""Oh shit... Here we go again""?",3,False,False,1573667820.0,2
"Why do girls don't regret after masturbation, unlike boys ?",16,False,True,1573667818.0,2
"What is something that needs to be said, but people are afraid to say it?",6,False,False,1573667814.0,2
What songs would you describe as eargasms?,18,False,False,1573667810.0,2
What’s the most powerful placebo effect you’ve ever experienced?,4,False,False,1573667809.0,5
What was the first thing you ever purchased on the internet ?,8,False,False,1573667807.0,3
"Redditors that are doing the secret santa thing, what are you getting for your Reddit gift buddy this year?",1,False,False,1573667807.0,1
What video game were you super stoked for but ultimately crushed with disappointment when you finally got it?,10,False,False,1573667806.0,2
"Anyone else think of something to ask all day, then think of something perfect in your mind, then delete it in shame when it gets no attention?",3,False,False,1573667782.0,3
"You literally cannot move anywhere but your current position for the next 24 hours, what does it look like/what do you do for the day?",15,False,False,1573667780.0,3
What are some interesting studies you have read recently?,1,False,False,1573667780.0,3
"People who havn't switched over to mechanical keyboards, what is your reasoning?",7,False,False,1573667779.0,2
What’s something you regret doing?,13,False,False,1573667760.0,3
"Redditors who skip at least one meal per day, which meal(s) do you skip and why?",18,False,False,1573667756.0,1
What was that one thing you used to obsess about at a young age?,22,False,False,1573667749.0,3
What's something you feel proud of doing but everyone thinks it's lame?,13,False,False,1573667748.0,1
how did you find out you were being cheated on ?,8,False,False,1573667739.0,1
How many memes do you think you have saved in your phone?,5,False,False,1573667719.0,1
Who are the top ten rappers Eminem was afraid to diss?,7,False,False,1573667712.0,2
What game takes the most disk space?,4,False,False,1573667698.0,2
What is the best movie or series produced in this decade?,7,False,False,1573667692.0,4
What’s the best way to fail upwards?,9,False,False,1573667678.0,4
Which way is better to know new girls?,5,False,False,1573667674.0,1
What method does Paul McCartney use to compose so many good songs?,3,False,False,1573667672.0,3
What is the most confusing conspiracy theory that someone told you who 100% believes it?,11,False,False,1573667657.0,1
What outdated phrases like “roll down your window” will still be used in the future?,7,False,False,1573667656.0,1
"People who make Instagram accounts for your pets, what’s going on with you?",17,False,False,1573667636.0,8
[NSFW] You have the opportunity to fuck ONLY ONCE your dreamed guy/girl BUT your best friend have to watch it. What do you do ?,25,False,True,1573667633.0,5
"How to earn 1,000,000 dollars starting from 0 the fastest way?",16,False,False,1573667630.0,5
"What’s your favourite soft drink (Coke, Pepsi, etc)?",9,False,False,1573667608.0,3
What was your favourite meme of the 2010s and why?,3,False,False,1573667604.0,2
Why do ppl put their horoscope sign in their IG bio? What's the goal?,4,False,False,1573667596.0,0
What is the most extreme/dangerous thing you have done?,9,False,False,1573667596.0,1
What is the best voicemail greeting you have heard?,15,False,False,1573667596.0,3
"Those who celebrate Christmas, what was your best Christmas and why?",2,False,False,1573667589.0,1
You have the power to curse people with minor inconveniences. What do you do to your enimies to slowly make them go insane?,18,False,False,1573667574.0,1
[Serious] What particularly divisive topics of the past have people seemingly forgotten about?,3,False,False,1573667568.0,1
What is the most shameful fight you’ve ever had online?,1,False,False,1573667548.0,1
"Sandwich shop workers of Reddit, what’s the weirdest thing you had to make for someone?",4,False,False,1573667544.0,1
What drugs would you really consume?,14,False,False,1573667539.0,2
"What was your dumb act that ultimately saved you from an unpleasant / dangerous situation, if there was one?",1,False,False,1573667529.0,1
This community is riddled with sad. Why are redditors so god damn depressed?,14,False,False,1573667528.0,2
"Guys, what do you actually think when you notice a girl checking you out?",10,False,False,1573667519.0,1
"What do you think of the ""opposite attracts"" idea about love?",7,False,False,1573667517.0,3
What is the best lesson in life you’ve ever learned and will give to others?,9,False,False,1573667514.0,3
What is the best White Elephant/Dirty Santa gift that you've ever seen be unwrapped?,2,False,False,1573667512.0,1
What physical benefits come with being one of the lizard people secretly ruling the world that regular mammalian people don't experience?,3,False,False,1573667511.0,3
What's the worst thing you have done while being drunk?,10,False,False,1573667496.0,2
Dear ex convicts. What's the funniest thing you witnessed in prison?,1,False,False,1573667482.0,2
What is happening in Bolivia?,3,False,False,1573667471.0,0
What are some ways to “find ones passion”?,3,False,False,1573667467.0,0
How do you dispense of your flatulence at work?,13,False,False,1573667464.0,2
What is something huge that happened to you that completely altered your view on the world?,3,False,False,1573667459.0,0
"You've been transported back in time exactly 1 week from today, what changes are you making?",6,False,False,1573667456.0,2
"You are offered $1 million for every full week you can survive in a Colombian prison. But once you leave, you can't start over. What do you do?",10,False,False,1573667453.0,1
What is something weird that you will always remember?,4,False,False,1573667451.0,2
What are some morbid celebrity coincidences that not many people know?,2,False,False,1573667444.0,0
What’s something that you want to brag about that would be weird to do anywhere else?,1,False,False,1573667440.0,1
What would you do if you have the entire world money?,8,False,False,1573667439.0,2
"If you had to disappear for whatever reason, where would you go and why?",1,False,False,1573667438.0,1
What’s the real-life equivalent to having to text first?,3,False,False,1573667423.0,3
"Girls, if you could change your father's look to one celebrity, who would it be?",3,False,False,1573667421.0,3
How many subscription services do you currently pay for?,2,False,False,1573667415.0,1
"For only 2 hours, you have full and total control of a secret ""super railgun"" clandestinely based on Earth's moon. How do you spend your 2 hours?",4,False,False,1573667413.0,2
"Trump supporters of reddit, why do you genuinely believe that the Ukraine scandal doesn't warrant impeachment and\or removal from office?",6,False,False,1573667413.0,2
What is the most ridiculous conspiracy theory you’ve ever heard?,5,False,False,1573667408.0,2
"Single people of Reddit, how do you get lotion to the center of your back?",19,False,False,1573667403.0,3
"Can Towels get high, if so then how?",5,False,False,1573667399.0,0
What is the question ?,7,False,False,1573667391.0,1
They say there is no such thing as a stupid question. What’s the stupidest question you’ve ever asked?,10,False,False,1573667382.0,3
"What movie was supposed to be sad, but you didn't find sad at all?",6,False,False,1573667370.0,3
What was something you were happy you lost?,5,False,False,1573667368.0,2
What is the dumbest scam you've seen on the internet?,5,False,False,1573667342.0,3
what is a good askreddit question to post?,6,False,False,1573667340.0,3
How do you usually avoid making small talk in group settings?,4,False,False,1573667333.0,1
What's your toxic trait?,5,False,False,1573667333.0,1
What small nuisance can make it impossible for you to relax?,8,False,False,1573667328.0,1
What has been your favorite meme of this year?,6,False,False,1573667322.0,1
What are your top three tv series of all time?,21,False,False,1573667311.0,4
People who work at a office is it like the show ?,11,False,False,1573667276.0,2
What are some classy pickup lines?,9,False,False,1573667274.0,3
"Deaf people who got hearing implants, can you hear your mindvoice? Do you think and hear a voice?",2,False,False,1573667256.0,3
Out of all the Nintendo heroes who has the hardest/dangerous job?,7,False,False,1573667250.0,2
What is your favorite cryptocurrency?,4,False,False,1573667246.0,2
"When you turned 30 and had to come to terms with how worthless you are, how did you handle it?",11,False,False,1573667239.0,2
"Retail employees, what’s you’re worst costumer story?",3,False,False,1573667224.0,5
What are some fun online maps to look at when you are bored?,5,False,False,1573667221.0,3
"What was your ""I'm done"" walk away moment?",8,False,False,1573667221.0,5
"People with cozy warm blankets and beds, what helps you get up in the morning during the colder seasons ?",9,False,False,1573667221.0,3
What's the dumbest fashion trend you've seen to date?,4,False,False,1573667215.0,3
"What is a common phrase, exclamation, or idiom you've heard, but don't really understand exactly what it means?",10,False,False,1573667186.0,5
What one fictional item would you bring into the real world and into your possession?,20,False,False,1573667184.0,4
"Your worst enemy is on a roof threatening to jump, what do you say to them?",11,False,False,1573667183.0,4
"Guys, what's your reaction when you notice a girl checking you out?",17,False,False,1573667175.0,3
What is your favorite video game quote?,15,False,False,1573667175.0,4
What is the most irrational fear you have ?,12,False,False,1573667170.0,4
What would you do if Google announces that they are going to remove Google Translate?,4,False,False,1573667169.0,2
You get to save one video that’s 30 seconds or shorter from this decade. What do you choose?,4,False,False,1573667167.0,3
What would you sell your soul for?,8,False,False,1573667166.0,2
People who have dated celebrities: How did you meet them and were there any issues?,1,False,False,1573667156.0,4
"Girls of reddit, what kind of messages are likely to elicit a response from you when a guy slides into your DMs?",4,False,False,1573667148.0,1
What was your worst experience at a sporting event?,2,False,False,1573667145.0,2
Who was/is your celebrity crush?,6,False,False,1573667143.0,3
What stops you from doing what you want to do?,13,False,False,1573667138.0,3
[SERIOUS] Where do you guys actually aim in the toilet ?,21,False,False,1573667121.0,1
What is the best gift to give a girl for Christmas?,12,False,False,1573667100.0,3
"What joke you heard was so absolutely hilarious, you actually couldn’t stop laughing even if you tried?",4,False,False,1573667092.0,2
What's something that scares you that you can't say will never happen for an absolute fact?,5,False,False,1573667087.0,1
What non traditional Thanksgiving food does your family always have?,13,False,False,1573667086.0,1
"Retail employees of Reddit, what are songs that can be deemed “retail nightmares”?",6,False,False,1573667076.0,2
You are the newest member of The Wu Tang Clan. What is your new rap name?,6,False,False,1573667058.0,1
"Redditors who had quit reddit, what made you come back?",1,False,False,1573667055.0,1
What’s the most beautiful sound in the world to you?,20,False,False,1573667023.0,3
How dentists annoy and piss you off?,3,False,False,1573667016.0,2
For those who went to a friends episode as an audience. How was it?,2,False,False,1573667011.0,1
What is your favorite fantasy world?,9,False,False,1573667009.0,2
(Serious) People who went through depression how did you get out of it?,10,False,False,1573666993.0,3
"People of Reddit, what is some strange fact you what to share?",11,False,False,1573666981.0,2
"Introverts of Reddit, how would you keep a conversation going?",12,False,False,1573666971.0,2
What are some decent paying jobs that don't require schooling?,16,False,False,1573666961.0,3
How would you describe Alexandria Ocasio-Cortez?,15,False,False,1573666951.0,1
"Why do parents call their sons ""Son"" but not their daughters ""Daughter?""",13,False,False,1573666939.0,4
What movie title is the best one to describe your sex life?,19,False,True,1573666929.0,1
"Hair dressers of reddit, what is the best shampoo to use?",2,False,False,1573666929.0,1
If 'Purge Day' was a real worldwide holiday - would you do any purging and if so who and why?,10,False,False,1573666922.0,2
"How is your ""idol in life"", the person you would like to be like, like?",4,False,False,1573666922.0,1
What is the ‘have you tried shutting it off and turning it back on’ of your job/profession?,10,False,False,1573666913.0,1
"Redditors with highly controlling parents, what did you do to get out from under their thumb? How did it impact you personally and professionally? [Serious]",6,False,False,1573666912.0,0
"How would you feel about a streaming service where instead of paying a monthly fee, you will only pay for what you want to watch?",7,False,False,1573666907.0,1
"We've heard of the ends justifying the means, but what is a situation where the means justify the ends?",13,False,False,1573666885.0,2
"What song, popular or not, has the most interesting story behind it?",4,False,False,1573666882.0,2
What do you wish you could do as a profession that you know you would be great at if someone would just give you the opportunity?,4,False,False,1573666877.0,0
Who is your all-time favorite tragic villain?,3,False,False,1573666876.0,0
[Serious] How do you feel when you think of how it feels to be nonexistent in a literal sense (kinda contradicting but not sure how to put it)?,6,False,False,1573666874.0,1
What are some weird things that you do?,3,False,False,1573666859.0,0
Why are many American tv commercials so negative and depressive?,8,False,False,1573666848.0,0
"From now on the entire Earth population wants to have sex with you, where do you hide?",28,False,True,1573666834.0,3
"Since 2020 is almost here, what do you think the single worst event of the last 10 years has been? What do you think the best one has been?",2,False,False,1573666831.0,1
What is the worst injury you didn't go to the hospital/doctors for?,3,False,False,1573666830.0,2
"Men of Reddit with a low self-esteem, are you trying to raise it? If so how?",1,False,False,1573666813.0,2
How do you become a moderator on reddit ?,5,False,False,1573666805.0,2
What is one dream that you desperately wish to dream again?,4,False,False,1573666799.0,3
"People who have completely cut all ties with a close friend, what was the reason?",17,False,False,1573666795.0,5
"For hipsters, emos, and other common stereotyped people, what were you doing when you realized you are the stereotype?",3,False,False,1573666783.0,2
"If you can change anything in the world, what would you change?",9,False,False,1573666765.0,3
What are interesting facts about yourself?,36,False,False,1573666758.0,3
Who do you think is one of the most underrated people in history?,2,False,False,1573666758.0,2
"If recreational drugs had their own marketing slogans, what might they be?",7,False,False,1573666756.0,3
How do you make a forced friendship work?,8,False,False,1573666738.0,1
"Just out of curiosity, why do the British always say ""brilliant"" to every CD that comes out of the UK?",3,False,False,1573666737.0,1
"If there is no life after death, what is the point of life in your opinion?",14,False,False,1573666731.0,3
"Redditors who are both religious and believe in ghosts, how does that tie into your faith?",3,False,False,1573666728.0,4
When did you first learn about death?,6,False,False,1573666723.0,3
What is your biggest pet peeve?,5,False,False,1573666715.0,4
What are the weirdest shower thoughts?,2,False,False,1573666710.0,2
"Redditors who keep a journal or diary; how do you use it in your life, and when do you look back at it if it all?",2,False,False,1573666702.0,2
What is the Biggest problem with reddit?,6,False,False,1573666697.0,3
What do you do on Christmas if you have no family nearby?,7,False,False,1573666629.0,2
What is the worst situation you have been in when your period had just started?,6,False,True,1573666687.0,2
