title,num_comments,spoiler,over_18,created_utc,score
What's a weird talent you wish you could show more people?,0,False,False,1573669896.0,1
What was the best Christmas present you ever received?,0,False,False,1573669892.0,1
You get to be a candidate in the upcoming US presidential elections. What is your election platform and why should we vote for you?,0,False,False,1573669883.0,1
Why was there an obsession with the colour silver when it come to 2000s electronics?,1,False,False,1573669875.0,1
"Why are the protests (HK, Chile, etc.) NOT ALL OVER the news?",3,False,False,1573669861.0,2
What was the weirdest way you have heard somebody explain sex to a kid?,1,False,True,1573669861.0,0
What are some shady businesses that you are aware of?,0,False,False,1573669857.0,1
Who is the worst US president?,1,False,False,1573669853.0,2
"What's something you know you shouldn't do, but keep doing anyway?",2,False,False,1573669852.0,2
"Therapist of reddit, or anyone in the medical field that has 1on1 convos with patient's. What is your most shocking moment? [SERIOUS]",1,False,False,1573669851.0,1
What is the most scariest experience in your whole life?,0,False,False,1573669847.0,1
"If you could pick one horror movie universe to live in, what would you pick, and why?",0,False,False,1573669846.0,1
How old were you when you realized the first initials of July - November = J A S O N ?,4,False,False,1573669830.0,2
What's a strange fact you know that others would find concerning?,0,False,False,1573669828.0,1
What is your favorite dinosaur and why?,6,False,False,1573669812.0,1
What are some good Christmas gifts for a 32 year old male? Maybe stuff they may not know they need?,3,False,False,1573669811.0,2
"If climate change will kill us all, why are we all going about our daily businesses? Why are we still being forced to go to work and to go to school when we could be making the most of last couple years of our lives?",2,False,False,1573669806.0,2
How boring are you? How insecure are you about it?,1,False,False,1573669805.0,1
What was the worst thing that happened during school?,2,False,False,1573669796.0,1
"People who wake up and get out of bed on time, how do you do that?",4,False,False,1573669787.0,2
What song makes you get up and do something or just gets you inspired?,0,False,False,1573669786.0,2
"Why won't Steven Crowder debate Sam Seder? Every tweet Crowder posts is full of ""debate Sam Seder"" and ""#coldfeetcrowder"" replies. Why won't Steven Crowder debate Sam Seder?",3,False,False,1573669773.0,1
What Is the best fake subreddit name that you have created?,0,False,False,1573669768.0,1
"Hiring manager of Reddit, what are your tips for a teenagers first job interview?",1,False,False,1573669765.0,3
How would you set up a friend?,0,False,False,1573669757.0,1
Think of a popular movie/tv show character. Which actor/actress do you think could've taken it to the next level?,1,False,False,1573669743.0,1
How do you cook your eggs and why is your way the best?,5,False,False,1573669737.0,1
"Redditors who used a college counseling service, how did it go?",0,False,False,1573669734.0,1
Dear people of reddit what is the most fucked uo thing you saw?,4,False,False,1573669729.0,1
What’s something that you spend more money on than you should?,4,False,False,1573669728.0,2
Redditors who got diagnosed with a mental disorders: What was your intention to visit a therapist and what was the therapy like?,0,False,False,1573669726.0,1
"Redditors who’ve distanced yourselves from social media, what made you make that decision and what kind of impact did it have on your life?",2,False,False,1573669695.0,3
"People who follow a strict schedule, how did you make it through the first month?",1,False,False,1573669693.0,2
"Taxi or ride sharing drivers who have had a passenger get in your vehicle and yell ""follow that car!"", how did that ride end?",0,False,False,1573669690.0,2
"If you could take one thing away from your life, what would you remove?",8,False,False,1573669689.0,2
What is a cool thing a company did or does in general?,2,False,False,1573669685.0,3
"How do you hold yourself accountable and keep on track with your goals, even when you feel they feel undoable?",3,False,False,1573669679.0,1
"Retail workers of reddit, what was the best way your manager dealt with a Karen?",0,False,False,1573669670.0,3
"Netfix, why dont they have anything good to watch?",8,False,False,1573669649.0,0
Whats cool about doing drugs?,9,False,False,1573669641.0,3
"Are there extra steps one should take to clean their cooking utensils when cooking for someone with a peanut allergy, if so what are they?",0,False,False,1573669641.0,1
[SERIOUS] What's the creepiest call you have ever got?,4,False,False,1573669622.0,3
If you could rename any element on the periodic table what would you name it?,4,False,False,1573669620.0,2
"Since the 2010s are coming to a close, what would qualify as Meme of the Decade?",5,False,False,1573669612.0,0
Which youtube videos from your country are considered classics?,2,False,False,1573669609.0,3
What was your worst experience using valet parking and why?,1,False,False,1573669605.0,1
What is the worst thing to write on a cake?,11,False,False,1573669596.0,1
"People of Reddit, what has been the best part of your week?",1,False,False,1573669589.0,2
Why is zero better than regular?,6,False,False,1573669587.0,1
What's your opinion on COPPA and how it affects YouTube?,0,False,False,1573669581.0,1
"(Wholesome answers) Americans of Reddit, what is your fondest memory of Thanksgiving Day?",1,False,False,1573669580.0,1
When do you know for sure that it's the time to quit your job no matter what?,1,False,False,1573669580.0,1
What's the funniest incident you've ever seen on Google Street View/has anyone you know ever been seen on Street View doing anything funny or had their face fully visible?,1,False,False,1573669575.0,1
What do you want for Christmas this year?,5,False,False,1573669559.0,3
What is your favorite type of cake?,17,False,False,1573669557.0,2
what was the greatest adventure you had as kid with your friends or imaginary friends ?,1,False,False,1573669544.0,4
What would you love to get for Christmas?,11,False,False,1573669543.0,1
"What surprised you the most, after finishing your education and getting a job in the ‘real world’?",5,False,False,1573669541.0,2
What’s your secret that could literally ruin your life if it came out?,4,False,False,1573669537.0,5
"Redditors, what is the worst Nightmare you have ever had?",1,False,False,1573669536.0,1
Where do you draw the line in a relationship?,8,False,False,1573669526.0,1
At what weight is someone physically unfuckable?,8,False,False,1573669512.0,1
"What’s that one song in your playlist that you always skip, but don’t take out?",1,False,False,1573669507.0,1
What’s the strangest thing you’ve ever witnessed?,8,False,False,1573669489.0,3
What's the easiest song to learn on the guitar?,7,False,False,1573669483.0,3
"Successful long distance relationships of Reddit, what's your story, and how did you make it work?",4,False,False,1573669464.0,1
"What would be your ideal ""Youtube""?",5,False,False,1573669463.0,1
What's the saddest thing a friend has ever said to you? [Serious],4,False,False,1573669457.0,3
What are some good subreddits to trade services/expertise for physical goods?,0,False,False,1573669444.0,1
What's pissing you off these days?,9,False,False,1573669444.0,2
"[Serious] Criminals or redditors who have been to jail multiple times, why dont you get it, or why do you think you can do that stuff and get away with it?",2,False,False,1573669442.0,1
What is the worst micro-transaction system in a mobile game that you know of?,4,False,False,1573669429.0,1
"What should you be doing right now, but instead are scrolling through reddit?",11,False,False,1573669429.0,4
What do you know about the private life of someone famous that other people might find surprising?,2,False,False,1573669425.0,2
"People Who have been bitten by a black widow spiders, what was the experience like?",1,False,False,1573669422.0,1
"Girls of reddit, what are things that guys do that makes them think they are creepy but you are ok with?",2,False,False,1573669411.0,0
"If we were to find a sentient, new species on another planet with similar physiology, what ""customs"" or ""tics"" do you think we would share with them because they're just so universal they were bound to happen?",4,False,False,1573669410.0,1
"Blind person who had never seen anything has the ability to see for the first time, what would surprise them the most?",4,False,False,1573669398.0,2
"What is something that you have done, or are doing that you hide from your significant other?",5,False,False,1573669378.0,2
What is one thing you always wanted to learn but never did?,4,False,False,1573669374.0,2
"Waitstaff of Reddit - some people say tip 15%, others 18%, some say 20% or more, some say not at all? What’s your real average?",2,False,False,1573669373.0,1
How did you react when you tasted your first alcoholic beverage ?,8,False,False,1573669368.0,4
"Stop what you’re doing and say to Siri “I see a little silhouette of a man.” After hearing the response, how do you feel inside?",1,False,False,1573669361.0,1
"What is your opinion about women who are flat chested, athletic, muscular and have a straight up and down(no curves) body shape?",7,False,False,1573669359.0,1
Why are Redditor so useless and just all round idiots most of the time?,21,False,False,1573669356.0,0
What is the funniest/most random persuasive speech topic you have heard?,3,False,False,1573669346.0,2
"Still recovering from a very frightening experience. Fellow redditors, what are your stories about intense hallucinations right before or right after going to sleep?",5,False,False,1573669338.0,2
Without considering career or financial perspectives and without societal judgment: What would your dream job be - and what are you actually doing right now?,6,False,False,1573669332.0,2
What’s difficult in being in a relationship?,3,False,False,1573669331.0,0
What was a time when you couldn't stop laughing inappropriately?,7,False,False,1573669325.0,3
"Fit people of reddit, what do you want to say to the out of shape people when they first attend the gym or start exercising?",3,False,False,1573669325.0,1
"[Serious] People who work 40/hrs a week and have college full-time, how do you make it work?",2,False,False,1573669324.0,2
"Couples of Reddit, what's the sweetest thing your SO has done for you?",1,False,False,1573669323.0,2
Who was the most incomparable person you shouldn’t have dated but dated anyways? Did it work out?,1,False,False,1573669323.0,1
"Police officers and the like, what happens to evidence when a case has been solved?",5,False,False,1573669307.0,2
"People of reddit, what is one superpower that sounds cool, but in real life would be really shitty?",3,False,False,1573669300.0,2
Have you ever had a dream that came true? If so what was it about?,4,False,False,1573669297.0,3
What man-made things will we still find 100 years from now in exactly the same form in stores?,7,False,False,1573669290.0,2
"2036: you are French President. A French-led ""No-Fly-Zone"" is in force over N-iger. You are informed that a US B-2 bomber has made an unauthorized incursion enroute to a carry out a strike on Egypt. The French Air Force has requested your permission to shoot the bomber down. How do you respond?",4,False,False,1573669287.0,1
Why does it seem like mustard is the most common condiment to spill on oneself?,1,False,False,1573669285.0,3
What is the most bizarre thing that ever happened to you?,4,False,False,1573669283.0,3
What’s your life story?,6,False,False,1573669270.0,2
Who is a better singer Ariana Grande or Beyoncé?,5,False,False,1573669270.0,1
What is the worst thing you've ever done to your sibling(s)?,4,False,False,1573669252.0,1
What words/phrases do you think are overused?,11,False,False,1573669252.0,2
What are some relatively unknown ways to just help the earth?,9,False,False,1573669250.0,2
People that wear pants tight enough to camel-toe/mammal-toe - why? Isn't that uncomfortable?,1,False,False,1573669242.0,0
What’s the worst TSA encounter you’ve ever had?,1,False,False,1573669237.0,1
What's a good mobile app/game that you love?,14,False,False,1573669219.0,1
What is the maximum number of upvotes a post on Reddit can get ?,13,False,False,1573669213.0,10
What are the negative consequences of loving money?,10,False,False,1573669208.0,1
"People Who Have Used ""You Need To Get Laid"" Or ""You Virgin"" Or Similar Insults In An Arguement Or Debate; Why Did You, What Did It Mean To You ""As An Insult"" That Made You Think Of It As A Retort?",3,False,True,1573669195.0,1
Earth is being destroyed by an asteroid in 50 days . A ship that can self sustain life and hold 100 humans will be humanities last hope. The top 100 comments on this post make the cut to be on the ship. What do you say to make the cut?,34,False,False,1573669186.0,10
[Serious] What is something that gives you a lot of enjoyment but has had negative side effects on your life?,12,False,False,1573669180.0,4
"doctors of reddit :how do you feel after doing a successful surgery,and the family starts thanking god instead of you.?",1,False,False,1573669163.0,4
[Serious] What's something that you genuinely admire about someone who you otherwise genuinely despise?,4,False,False,1573669160.0,4
"What are the 2 most predominant colors where you are right now, and what is your mood?",12,False,False,1573669159.0,3
What’s a bad song that you love?,8,False,False,1573669153.0,4
what’s the most frighteningly genius idea/invention you have ever heard of?,3,False,False,1573669152.0,1
Whats something we can all agree on?,26,False,False,1573669143.0,8
What's an interesting stereotype/misconception that people have for THEIR OWN group/culture/country?,2,False,False,1573669138.0,1
What is you favorite song of all time?,9,False,False,1573669132.0,2
Have you ever thought about suicide and why?,3,False,False,1573667674.0,2
What’s the point of a robe?,7,False,False,1573669128.0,4
"Men of Reddit, what’s something that women need to stop doing?",6,False,False,1573667790.0,3
What are some good ways for a noob to waste their time on reddit?,3,False,False,1573668085.0,4
what is the weirdest tradition in your family?,1,False,False,1573669119.0,1
"To all atheists on Reddit, what’s your main argument against (religious) belief?",7,False,False,1573669118.0,1
What do you assume to be true but have no actual facts to back it up?,2,False,False,1573669115.0,2
What is something really useless you're good at?,3,False,False,1573669112.0,1
What can you bring to a funeral that would instantly ruin it?,9,False,False,1573669017.0,1
What can you get a year's supply of for £20?,7,False,False,1573669099.0,3
What is a good gift to buy for someone you hate?,5,False,False,1573669093.0,1
"[Serious] Survivors of mental illness, what were some early signs of your illness before diagnosis that were obvious in hindsight?",1,False,False,1573669085.0,2
Why do Fedx reps knock on the door like crazy people?,3,False,False,1573669082.0,2
What is the most underrated and overrated job in the world?,6,False,False,1573669064.0,4
"Incels of Reddit (In a strictly literal sense, not jaded about it): What do you think it is about you that repels potential romantic partners?",15,False,False,1573669062.0,1
What is the “right thing” to do if a friend is cheating on his girlfriend/boyfriend?,16,False,False,1573669035.0,5
"People of Reddit, what's the longest you've ever kept a secret from someone or vice versa, and what made the beans finally spill?",2,False,False,1573669030.0,3
Is there anyone here that still using dial-up internet in 2019? Why?,3,False,False,1573669029.0,4
"[Serious] Redditors that have bounced back from a hard time well, what is some advice you can give other redditors going through a tough time?",6,False,False,1573669025.0,3
What is your choice of Alcohol?,18,False,False,1573669020.0,3
"car detailing people of Reddit, what's the weirdest thing you've found in a vehicle?",2,False,False,1573669014.0,2
"What are some evidence cryptids such as Bigfoot, might exist?",1,False,False,1573669012.0,1
"If you had to chance to re-live one specific day, knowing you couldn’t change anything about it, what day would that be and why?",6,False,False,1573669005.0,4
"People of Reddit, what is stressful to you but normal to others?",6,False,False,1573669003.0,1
"Transgender men and women of Reddit, how has your experience of sexism changed over the course of and after your transition? Did you expect it to change that way?",1,False,False,1573668992.0,3
Reddit what are your embarrassing moments that you always think of when you’re trying to sleep?,1,False,False,1573668990.0,1
What CDs did you buy from a commercial when you were younger?,2,False,False,1573668981.0,2
What’s the best free adult websites out there?,8,False,False,1573668979.0,2
If you have given the power to change the past just for once what would you Change?,3,False,False,1573668963.0,2
When has there been documented paranormal or supernatural activity in History?,16,False,False,1573668960.0,2
"Aspiring directors of Reddit, what was the plot for your first “real” movie?",0,False,False,1573668960.0,3
At what point did you realize you weren't in touch with the youth anymore?,7,False,False,1573668956.0,3
What is the worst lie your ex told you?,4,False,False,1573668947.0,4
What was the most insane/unexpected thing that ever happened to you in your time at school?,0,False,False,1573668944.0,3
Which country gets a bad rep due to an outlier?,3,False,False,1573668938.0,4
This decade is about to end. What all notable things did you do in the last 10 years?,11,False,False,1573668937.0,3
"If you were to go to jail, what would it be for?",8,False,False,1573668935.0,2
"People who work as chat agents, what is your position (such as tech support or customer service reps for an phone or internet company), and how many chats are you responding to at the same time? Are you also taking phone calls at the same time?",0,False,False,1573668930.0,4
how would someone who hates you describe you?,3,False,False,1573668924.0,1
What is the best way to get your life out of hell?,6,False,False,1573668919.0,1
What was the closest thing to a paranormal activity that you ever witnessed ?,14,False,False,1573668907.0,4
What adjectives make you think of a smell or taste?,4,False,False,1573668905.0,3
what’s sometime you love but wish you hated/vice versa?,6,False,False,1573668898.0,4
"Did you have a nickname when you were growing up? If so, what was it and where did it come from?",5,False,False,1573668894.0,2
The Mueller Report didn't change anyone's mind. How exactly will these public impeachment inquiry hearings change people's minds?,12,False,False,1573668881.0,0
What is it with white girls and The Office?,7,False,False,1573668880.0,0
"People of Reddit , what do you think your net worth is ? Does this bother you or make you happy and how do you plan on changing it ?",3,False,False,1573668879.0,1
"Reddit folks who have spouses stationed overseas, how do you cope with something like that especially during the holidays, and how long did it take to get used to then being gone?",0,False,False,1573668876.0,1
"People who have been homeless, what was that first night like?",1,False,False,1573668875.0,2
What are some red flags indicating that a job is BS?,5,False,False,1573668873.0,3
"You’re the leader/president of your country, you have the chance to Make a new law or fix a current one. But the first reply to your post is the side effect after the event. What’s your change?",14,False,False,1573668871.0,3
What’s it like being an ant?,5,False,False,1573668869.0,1
when were you the most disappointed in a family member?,1,False,False,1573668868.0,1
"Women of Reddit who have filed a sex discrimination grievance, what happened and how did you handle it?",1,False,False,1573668857.0,1
What triggers your OCD?,8,False,False,1573668844.0,1
"Doctors/Nurses of reddit, what are you most proud of in your career?",0,False,False,1573668838.0,1
What is your biggest concern right now and why?,9,False,False,1573668836.0,2
Can anyone recommend the best audio course / podcast / app that would help teach you how to learn another language for long commutes ?,4,False,False,1573668833.0,1
[Serious] What's the most embarrassing thing you've done up until this point?,2,False,False,1573668814.0,2
What are you waiting for ?,17,False,False,1573668799.0,3
What are some of the worst things about being a neurotic person?,1,False,False,1573668796.0,1
[Serious] How do you deal with the idea that someone you care about but are no longer in contact with (an ex lover or ex best friend) could die without you knowing about it?,5,False,False,1573668795.0,1
"Guys, what goes through your mind when you see a girl checking you out?",17,False,False,1573668793.0,3
Do any of you glorious Redditors use poop shoes at work? Why?,7,False,False,1573668788.0,0
"After a night of drinking, you wait up in a jail in Dar Es Salaam. What happened and what do you do?",2,False,False,1573668787.0,1
"Professional Workers Of Reddit , What's the Craziest , Scariest , Or most Unbelievable thing you've Witnessed?",2,False,False,1573668785.0,1
"People of Reddit who actually ran away, how did it go and what happend?",3,False,False,1573668784.0,1
"People of Reddit, what did/do the fights between you and your siblings look like?",2,False,False,1573668782.0,2
You get to become any character in any book. Who do you choose?,14,False,False,1573668779.0,1
What bad but conceptually cool movies could use a remake?,12,False,False,1573668775.0,3
What train-wreck of a sub do you have to slow down to look at while browsing every day?,4,False,False,1573668771.0,3
What's something you did as a kid that people still bring up in converation today?,11,False,False,1573668765.0,3
What's the easiest way to make a girl Blush ?,9,False,False,1573668764.0,2
"You get pulled over by a police officer for going 15mph over the speed limit. What’s the best excuse you can think of, that will help you avoid getting a ticket?",8,False,False,1573668758.0,1
What do blind people see?,21,False,False,1573668750.0,5
What is this from? The plot is that people start buying merch for this team since they have a controversial name so that they can burn it. Then other teams make their names controversial (related to guns and stuff) so people will buy their merch to burn it to make money. What’s the plot from?,2,False,False,1573668744.0,2
In the Harry Potter Universe you've been granted to kill one character and prevent the death of one or bring them back. Who you saving and who you killing and why?,9,False,False,1573668717.0,3
What competition would you get a gold medal in?,14,False,False,1573668711.0,5
"In your opinion, what is the most wtf phobia that exists?",13,False,False,1573668703.0,3
"Alright nerds of reddit, What is the best order to watch Star Wars and why?",11,False,False,1573668694.0,2
"If memes had physical forms, what would one look like?",6,False,False,1573668688.0,3
How does it feel to be living in the month that the movie Blade Runner is set in?,5,False,False,1573668686.0,3
What ’upgrade’ was totally worth the price?,6,False,False,1573668676.0,5
People of reddit how did you feel when you received your first badge on reddit?,11,False,False,1573668674.0,1
What word have you been pronouncing wrong until recently?,11,False,False,1573668660.0,1
(To the Minecraft players out there) What makes you want to continue playing the game till dis day?,3,False,False,1573668657.0,1
If you could look into the past OR into the future which one would you pick and why?,3,False,False,1573668653.0,1
What movie character is very much similar to your real life?,8,False,False,1573668644.0,2
what conversation do you hate talk about with your parents?,3,False,False,1573668643.0,0
(Serious) What is the most expensive accident/mistake someone has done in your workplace?,2,False,False,1573668642.0,1
"What if someone wants to be a philosopher, mathmatition, physicist, scientist, astronomer, archaeologist, ect.?",10,False,False,1573668636.0,4
"With the US elections coming up, who are you voting for?",29,False,False,1573668626.0,3
What are some ways to tell a good friend apart from a bad friend?,8,False,False,1573668626.0,0
What is the most cringe inducing moment of empathetic embarrassment you have ever experienced?,1,False,False,1573668614.0,1
"Men, what do you actually think when you notice a woman checking you out?",11,False,False,1573668611.0,0
What quote describes your life entirely?,6,False,False,1573668602.0,2
What are the unwritten rules about walking in hallways/around corners with respect for other people?,5,False,False,1573668602.0,2
Whats the rudest thing you've said or done to a stranger?,1,False,False,1573668596.0,4
"If skills were easily tradeable, what skill would you trade and for what?",3,False,False,1573668590.0,1
People who voted for Trump. Would you do it again?,17,False,False,1573668577.0,3
What is the weirdest thing you've done this week?,4,False,False,1573668562.0,3
"When you reach the age of 50 you are put in a arena to have a sword fight against the person you hate the most, will you live or die?",7,False,False,1573668554.0,1
"Since the 2010s are ending next month, what’s the meme of the decade?",8,False,False,1573668533.0,4
What are some video games that have aged badly ?,6,False,False,1573668529.0,2
How would life be different if we'd adopted the base 12 number system?,5,False,False,1573668526.0,2
"If you had the ability to gift every person in this world a gift under 5$, what would you give?",20,False,False,1573668516.0,4
whats the one thing *Everyone* hates that you like?,10,False,False,1573668514.0,2
