title,num_comments,spoiler,over_18,created_utc,score
How do you deal with a professor who have not graded a single assignment when it is almost the end of the semester?,6,False,False,1573666673.0,4
What gets worse the more you see it?,12,False,False,1573666661.0,3
What Is One Thing You're 100% Sure You've Been Doing Wrong Your Whole Life?,11,False,False,1573666657.0,5
What is a super funny business idea?,2,False,False,1573666655.0,2
What hill ARE you willing to die on?,6,False,False,1573666646.0,1
"People of Reddit, what has been your favorite meme of this decade?",7,False,False,1573666639.0,0
"If you have ever had a supernatural experience, what happened?",6,False,False,1573666638.0,1
Which subreddit describes your personality?,8,False,False,1573666637.0,1
"Sports fans of Reddit, what is some sports lingo that a non sports fan wouldn’t understand?",0,False,False,1573666637.0,1
What if a roommate is a jacked hunk who loves to lift in the dormitory naked?,19,False,False,1573666631.0,0
"If you could go forward or back five minutes from now, which way would you go, and what would you do?",7,False,False,1573666622.0,2
What is something stupid you did all because someone you were attracted to was there?,3,False,False,1573666591.0,1
What was your experience with smoking Salvia?,3,False,False,1573666590.0,1
What is the most awkward situation you have ever been in when you have got a random boner?,7,False,True,1573666587.0,0
"How do you convince a partner that they really don't want to know something, when the matter will never affect them or their future life?",2,False,False,1573666583.0,1
Is intentional or a coincidence that 240V is a multiple of 120V which is a multiple of 60Hz?,4,False,False,1573666581.0,0
"There is a button, each time you press it you get 50$ but a random person dies. You can press it as many times as you want. How many times do you press it?",27,False,False,1573666579.0,1
"If someone in the next stall hasn’t made a pooping related noise in 10 minutes, what are they doing in there?",14,False,False,1573666564.0,3
[NSFW] What non-sexual situation with someone was filled with sexual tension and you couldn't do anything about it?,5,False,True,1573666563.0,2
How do you stay motivated trying to hunt for entry level student coop positions (especially when it's super competitive and you aren't a genius)?,0,False,False,1573664525.0,1
What's your favorite shower thought?,9,False,False,1573666555.0,4
what's something that you didn't realize was unique to your country until you went abroad?,3,False,False,1573666553.0,1
How do you confirm if someone is ghosting you?,3,False,False,1573666545.0,2
"Government employees, why are you, on average, such massive pieces of shit?",9,False,False,1573666519.0,0
What comeback left you dumbfounded?,0,False,False,1573665598.0,1
What interesting or scandalous things happened during a school detention you experienced?,1,False,False,1573666502.0,1
"If you can combine 2 games as one, which games would you choose?",14,False,False,1573666499.0,4
You’re hereby able to survive and feeling well without eating for a year. How would you spend it?,4,False,False,1573666488.0,2
When does it make sense to be kind vs nice to someone?,2,False,False,1573666485.0,0
"If we say ""bless you"" b/c your soul leaves your body when you sneeze, when would be an appropriate time to say ""curse you""?",11,False,False,1573666483.0,5
"What name brand product's placement in a movie was so effective, you forever associate the two?",8,False,False,1573666478.0,1
"Gamers of Reddit, what do you hate doing in your favorite game?",10,False,False,1573666477.0,3
"If your son had a child with your wife and that child had a daughter with your mother, what is the daughter’s relationship to you?",16,False,False,1573666463.0,2
"What's your best ""Damn doctors are impressive"" story?",1,False,False,1573666461.0,1
"People who own animals that will live for a really long time (parrots, turtles...) what are your thoughts about what will happen to the animal if you get bored or die?",4,False,False,1573666460.0,1
What was the most unusual dish you’ve ever eaten?,9,False,False,1573666452.0,3
"Teachers of Reddit, what are your thoughts on student favoritism? Did you ever favoritize a student of yours?",4,False,False,1573666450.0,3
What's alright if you are the one doing it to the others but suddenly it's all kinds of wrong if the others did the same to you?,3,False,False,1573666446.0,2
What is Love in simple sentence?,9,False,False,1573666446.0,3
[Serious] What medical issue are you experiencing but have been thus far unable to find the cause of?,11,False,False,1573666436.0,2
"Hey Reddit, what have you learned about love?",14,False,False,1573666431.0,7
What was your rosebud moment?,1,False,False,1573666428.0,0
(Nsfw) Why are you into hentai and not real porn?,18,False,True,1573666426.0,3
"People who are depressed because of a traumatic event/events, what do you think about the clinically depressed people who haven’t gone through a trauma?",2,False,False,1573666420.0,2
Which scientific field seems pointless to you?,12,False,False,1573666408.0,3
"After rubbing your uncles lamp a mischievous genie make a proposal ""I will give you $10 million dollars if you can get yourself fired merely by telling your boss one single fun fact""; what is your fun fact?",10,False,False,1573666398.0,4
How do you feel about the fact that toast is just twice-baked bread?,17,False,False,1573666385.0,4
Does the small cavity between your cheek flesh and teeth make a little sound when you smile?,6,False,False,1573666385.0,5
What have you invented in your head but dont know how to make it work yet?,8,False,False,1573666361.0,4
What are some unknown facts the world needs to know about the world?,4,False,False,1573666346.0,5
What’s a unfun fact you know?,7,False,False,1573666345.0,3
Ex- skinheads: what made you leave it all behind?,8,False,False,1573666334.0,9
"Residents of Alaska/Hawaii, what is something about living there that the other 48ers don’t understand?",0,False,False,1573666318.0,3
"Redditors who workout in the morning, what’s your secret?",7,False,False,1573666315.0,3
"couples who walk slow together in highschool hallways, why?",0,False,False,1573666308.0,3
"For the guys that are not single , how ?",21,False,False,1573666304.0,2
What countries do you think will be involved in the next world war?,6,False,False,1573666301.0,4
How does one speak like a Real man?,6,False,False,1573666295.0,2
"If we really do live in a simulation, whats the weirdest/creepiest glitch you've had?",5,False,False,1573666287.0,3
"People who dont like Elon Musk, why?",9,False,False,1573666277.0,2
What’s your favorite snack from abroad?,22,False,False,1573666274.0,2
What would you do with dishes that your dad brung out of his dirty filthy room for you to wash out that smell so bad and have been in his room for several months?,11,False,False,1573666268.0,2
"Girls, what defines the line between an acceptable way of checking you out and a creepy one?",5,False,False,1573666245.0,1
What is the most important part of a BLT?,12,False,False,1573666242.0,0
"Rich people of Reddit, how did you make your money?",21,False,False,1573666239.0,2
What's something unique to your country that you weren't aware of til you went abroad?,9,False,False,1573666226.0,0
You suddenly have the power to heal anybody's physical illness/disability instantly with a wave of your hand. How would you handle this new power?,12,False,False,1573666224.0,3
What was your best attempt at revenge that failed?,3,False,False,1573666203.0,1
What is the most stupid sentence you've ever heard come out of someones mouth?,11,False,False,1573666202.0,2
"what was your badass ""bring it"" moment?",4,False,False,1573666193.0,2
What should be the meme of the decade?,2,False,False,1573666192.0,1
"why is Planes, Trains, and Automobiles the only thanksgiving movie?",11,False,False,1573666191.0,2
"What do you subtly do to get back at a Customer/Guest who annoys, upsets, or just hits a pet peeve of yours?",2,False,False,1573666188.0,0
what kind of materials/resources are required to make renewable/green energy more widespread?,3,False,False,1573666183.0,1
What are your top family Thanksgiving activity ideas?,9,False,False,1573666170.0,1
"Due to your area of expertise, what movie detail/scene always bothers you?",7,False,False,1573666163.0,2
What would would you or your life in a sentence be?,4,False,False,1573666162.0,2
What do you think will happen at the impeachment hearing today?,9,False,False,1573666147.0,0
"People who take forever in the shower, what is the exact reason why?",15,False,False,1573666145.0,3
Is it morally acceptable to be a fan of someone’s work when they’ve done horrible things?,20,False,False,1573666142.0,4
What surprise did you find in the pocket of your winter coat when you put it in for the first time this season?,4,False,False,1573666141.0,1
"What is the most illegal thing ,you ever did?",24,False,False,1573666130.0,6
"Gamers of reddit, what is the funniest thing that has ever happened to you while gaming?",4,False,False,1573666119.0,3
Redditors who have escaped from the prison. How'd you do it?,4,False,False,1573666116.0,0
When was the best time to be alive?,7,False,False,1573666112.0,3
What did you think of the new Sonic trailer?,5,False,False,1573666110.0,2
What’s the weirdest thing someone in your school was proud of?,5,False,False,1573666101.0,2
In what country/countries do the nicest/friendliest people live and where do the rudest people live?,7,False,False,1573666100.0,2
What is that thing that everyone beats you at and fustrates you?,3,False,False,1573666093.0,2
What do you believe in?,9,False,False,1573666082.0,2
What quote or text have you heard/read that has had the most profound effect on your life?,6,False,False,1573666068.0,1
For those who’ve tried the gender swap filter on themselves: How would you rate yourself as the opposite sex?,13,False,True,1573666063.0,5
How do you start beef with someone?,4,False,False,1573666062.0,1
Who’s the coolest person you know or heard of?,5,False,False,1573666059.0,2
What's the worst prank someone has done to you?,2,False,False,1573666058.0,1
What is something that is considered normal by everyone but is actually weird when you think about it ?,9,False,True,1573666046.0,2
What's some good hentai u guys prefer?,14,False,True,1573666032.0,1
What did you regretted buying right after you brought it?,8,False,False,1573666028.0,1
What's the best Church you've ever been to?,4,False,False,1573666026.0,3
"If you could have one thing from a game, movie, books series etc what would it be and what would you use it for ?",1,False,False,1573666019.0,2
What was the worst move you've made during sex ?,14,False,True,1573666015.0,0
What small daily events give you the fear?,2,False,False,1573666014.0,1
Is chewing ice truly bad for your teeth? If so how?,5,False,False,1573666011.0,1
"Gamers of Reddit, what moment in gaming made you cry the most?",13,False,False,1573665998.0,4
Subscribers of reddit premium what is the best feature that you like about it?,0,False,False,1573665983.0,4
"Hey Australian Redditers, An Indian here, wanted to send some stuff to a friend living in Sydney. What is allowed and not allowed for shipping?",3,False,False,1573665978.0,2
"To those who have been through a divorce, what advice would you give to people about to get married?",5,False,False,1573665963.0,2
"If there were to be a zombie apocalypse, what is your new plan of action?",12,False,False,1573665919.0,2
"[Serious] Band managers, concert promoters, and venue operators of Reddit, how do ticket prices get decided for a given concert?",2,False,False,1573665915.0,1
What do you think of Mary Magdelene?,7,False,False,1573665914.0,1
If you had 24 hours left to live. How would you spend it?,9,False,False,1573665903.0,2
What product designs can not be improved any more ?,4,False,False,1573665896.0,2
"Lawyers of Reddit, what mistakes have your clients made before contacting you that made your job much harder?",0,False,False,1573665875.0,2
"If you had to choose between Fame or Fortune, which would you choose?",10,False,False,1573665861.0,2
How does changing sexual positions make it better or worse for guys?,8,False,True,1573665852.0,2
What are you most addicted to?,26,False,False,1573665841.0,4
Any real life stories or people you’ve come across which would make for an amazing documentary?,2,False,False,1573665833.0,1
Why the sun in Teletubbies have a babyface ?,7,False,False,1573665829.0,3
"Would having a ""knights of sidonia"" situation on what gender teens turn into eliminate lgbt community?",4,False,False,1573665828.0,0
What is a product that has driven furthest away from its original use?,4,False,False,1573665827.0,2
"If you could turn back time at will, but only go back one minute, what would be the best usage of such power? For what purpose would you use it most often?",7,False,False,1573665824.0,1
"Can you live a decent life even if you dont have a diploma, why?",2,False,False,1573665819.0,1
What is the nicest way of saying Fuck you?,14,False,False,1573665806.0,1
"How does a refrigerator know when to turn on the ""change filter"" light?",3,False,False,1573665805.0,2
"If you're not wealthy, or not already in politics, how has discussing politics with other people ever actually benefited you?",17,False,False,1573665794.0,4
What is the one lie you tell everyone about yourself for so long that you now start to believe it as well?,6,False,False,1573665784.0,10
Chicago deep dish plzza is that really a thing?Why?,7,False,False,1573665781.0,2
How to deal with a professor who put tricky questions on the exams?,6,False,False,1573665777.0,2
Why was your Reddit account suspended?,5,False,False,1573665769.0,1
How do you perceive your memories?,1,False,False,1573665762.0,2
"Gamers of reddit, what's the best game you've played?",55,False,False,1573665757.0,11
What meme will still be remembered a century from now?,4,False,False,1573665741.0,3
What was the first thing you watched on Disney+ and why?,4,False,False,1573665741.0,1
What is the weirdest thing you've ever seen done in a porno?,39,True,True,1573665741.0,1
"People of Reddit, What was your most dramatic Thanksgiving experience?",3,False,False,1573665740.0,3
"As the New Year is approaching, the 2010s are about to come to an end. What are your top 3 memes of the decade?",1,False,False,1573665738.0,3
"Physcopaths of Reddit,when did you discover you were one?",6,False,False,1573665734.0,4
What would happen if you spoke your mind?,10,False,False,1573665722.0,2
"[Serious] Lawyers of Reddit, when have you genuinely been relieved/happy to lose a battle?",1,False,False,1573665714.0,1
What common motivational saying is actually complete BS?,11,False,False,1573665714.0,3
What has a doctor or nurse done accidentally that resulted in making your injury worse?,11,False,False,1573665713.0,3
What are some of your favorite funny answers/euphemisms for everyday/common questions?,3,False,False,1573665708.0,1
"If you could press a button which would switch you with a random person somewhere else in the world, would you press it?",3,False,False,1573665707.0,2
"Fighting game players of reddit, what game got you into fighting games and why?",6,False,False,1573665696.0,3
"People of Reddit, how do you blow off some steam?",7,False,False,1573665693.0,1
What is the stupidest thing you've ever heard someone say??,9,False,False,1573665678.0,1
"Married or soon to be married people of Reddit: what made you look at your partner and go ""yep, this is the one I'm gonna marry?""",12,False,False,1573665671.0,10
Step by step instructions on how to stop liking someone romantically?,8,False,False,1573665664.0,2
People of Reddit! What is your biggest pet peeve?,7,False,False,1573665655.0,1
"Girls, what do you pay attention to when you are checking out a guy?",22,False,False,1573665646.0,6
What's your top 5 movies of this decade?,4,False,False,1573665640.0,2
Trump removes his mask and reveals he's been Andy Kaufman since the 1980s. How do you react?,5,False,False,1573665633.0,2
What do you wish you knew when you were 19?,15,False,False,1573665633.0,2
Which meme you think should win 'Meme of the decade'?,4,False,False,1573665610.0,3
Owners of PS4 what's your favourite game and why?,21,False,False,1573665607.0,3
"to the people of reddit, what is your most favourite memory?",0,False,False,1573665590.0,4
What ‘advice’ are you so happy to not have followed in retrospect?,6,False,False,1573665587.0,3
What’s a scam lots of people fall for?,40,False,False,1573665555.0,3
What's the funniest thing you've ever done?,3,False,False,1573665548.0,4
"Overnight you become an A-list celebrity, what secret or scandal from your past are you worried about ruining your new career?",6,False,False,1573665543.0,3
What is the last Minecraft block you want to place?,5,False,False,1573665527.0,1
Where is the last place you would want to see a baby photo of you?,6,False,False,1573665523.0,4
In what situation(s) does age excuse your actions?,9,False,False,1573665520.0,4
"If someone were to ask you what your idea of ""feeling normal,"" or ""being normal"" was, how would you describe it to them? To make it fun: If you have a diagnosed/known mental disorder, share what you were diagnosed with if you feel comfortable?",1,False,False,1573665507.0,4
Thanos lost the infinity gauntlet and you have found it. What is the first thing you snap your fingers for?,13,False,False,1573665500.0,4
What is the scariest thing to happen in your house?,8,False,False,1573665490.0,6
How to fix your ears?,12,False,False,1573665484.0,3
"Men on Reddit, what was the first time you consciously nutted?",6,False,False,1573665478.0,2
Do you think you'd be able to pass for a downs syndrome person if you tried to compete in the special Olympics? How would you do it?,16,False,False,1573665472.0,2
How do you get laid?,40,False,False,1573665456.0,4
"People with rich relative, what's your life like? What are the common problems being rich?",4,False,False,1573665452.0,3
"Do you remember the moment you realized that you weren't a child anymore, if so what was it?",3,False,False,1573665451.0,3
How do you cope up with overthinking of negative outcomes of a situation ? its sometimes depressing when your mind conjures up all the negative outcomes and you cant help it. so how do you cope up with it?,3,False,False,1573665442.0,4
What are the few ways to enlightenment?,18,False,False,1573665431.0,2
"What are some of your biggest pet peeves, or uncommon ones?",8,False,False,1573665431.0,3
How do you fight against existential issues?,1,False,False,1573665429.0,3
"If you were in a contest and were absolutely starving, how many Keebler Elves do you think you could eat raw?",9,False,False,1573665425.0,5
What is the weirdest orgasm you ever got?,7,False,True,1573665413.0,3
People of reddit who came across something paranormal. What happened?,23,False,False,1573665406.0,1
Why doesn't UPS trucks have dash cams?,1,False,False,1573665404.0,1
What is the one conspiracy that you actually believe?,6,False,False,1573665392.0,4
How would you feel about normalizing cursing?,11,False,False,1573665379.0,5
What was your worst police encounter?,8,False,False,1573665374.0,3
Why do you/ do not believe that afterlife exists?,8,False,False,1573665367.0,2
[Serious] How many licks does it take to get to the center of a tootsipop?,6,False,False,1573665362.0,1
People of Reddit what cool dinosaur facts do you have?,7,False,False,1573665359.0,4
"Hey Redditworld, what's your opinion on fantasy football?",9,False,False,1573665354.0,1
"To the blind that gained ability to see, what surprised you the most?",4,False,False,1573665353.0,6
How to explain Quantum Physics to a 3 years old kid ?,12,False,False,1573665346.0,5
What would be the real-life equivalent of overtime in video games ?,2,False,False,1573665332.0,1
What are some real possibilities that could start WW3?,16,False,False,1573665331.0,3
What’s the strangest experience you’ve had in a public restroom?,5,False,False,1573665313.0,1
Which one is your vote for meme of the decade(tag it)?,2,False,False,1573665298.0,0
"[Serious] Reddit, if you had been laid off for a month and returned to work but still don't get paid for 2 weeks and have no money how would you ask a stranger to paypal or cashapp you money to help you get by?",6,False,False,1573665297.0,0
When did being fake sick actually lead you to finding out you were actually sick?,3,False,False,1573665297.0,1
What Are Dumb But Interesting Facts You've Learned?,1,False,False,1573665296.0,0
"Non gym goers of reddit, why dont you care about your personal health and well being?",20,False,False,1573665289.0,0
"Redditors who do drugs, What are some of your favourite stories from when you were high?",17,False,False,1573665282.0,1
What to gift somebody for their 80th birthday?,5,False,False,1573665279.0,2
What are your dreams?,2,False,False,1573665274.0,1
What is your favourite way to ruin the lyrics of a song?,6,False,False,1573665274.0,2
"Vampires of Reddit, how do you deal with not being able to see yourself in the mirror?",7,False,False,1573665271.0,0
What's your favorite movie that takes place in a 24 hour span?,3,False,False,1573665265.0,0
What’s one thing you won’t do for love?,10,False,False,1573665251.0,0
What food do you usually have at your Thanksgiving?,10,False,False,1573665227.0,2
What are you allergic to and how did you find out?,8,False,False,1573665225.0,0
Are you unaffected by the uncanny valley? What is a time you recall one way or another?,4,False,False,1573665222.0,0
"Average or attractive girls of reddit, why do you complain about your dating life and guys using you but you don't actually try to be friends with them?",55,False,False,1573665218.0,0
"Redditors who watch loads of memes, which memes do you think would save the planet if politicians looked at them?",0,False,False,1573665216.0,1
What does Kirkland brand something mean?,7,False,False,1573665213.0,2
What do you think about on the toilet?,15,False,False,1573665203.0,7
How do you know when to trust someone?,10,False,False,1573665200.0,2
"iPhone users, what’s the best sentence you can type by pressing the middle button of your keyboard?",28,False,False,1573665192.0,1
"Dear bullied people,what was your worst bullying case and how did you manage to stop the bullying?",18,False,False,1573665191.0,3
What event in your life has changed the way you see something?,3,False,False,1573665188.0,4
Would you press the Nuclear button and why?,11,False,False,1573665181.0,1
What's your passion project?,1,False,False,1573665179.0,2
What is something that you are really hyped for but will probably never happen?,5,False,False,1573665177.0,3
Why is your favorite song your favorite song?,9,False,False,1573665175.0,5
What is the thotiest thing you’ve seen a girl do in public?,2,False,False,1573665165.0,2
"If you could pause and check your ""stats,"" what stats would you want to know about your life?",12,False,False,1573665141.0,3
"How Many Times Do We Have To Teach You This Lesson, Old Man?",5,False,False,1573665134.0,0
How is the Mexican food in Venezuela?,4,False,False,1573665133.0,0
"Redditor's who work outside for a living. Do you feel accomplished when your project/s have been completed or do you wish for a A/C, 9 to 5 office job?",2,False,False,1573665133.0,1
What is the most amusing thing you've ever done in school/college?,3,False,False,1573665130.0,2
If you had to select one good historical figure to die who would you pick?,3,False,False,1573665129.0,2
What are some of the best TEDx videos you've ever come across?,3,False,False,1573665128.0,0
"If you could make your farts smell like anything, what would they smell like?",7,False,False,1573665126.0,2
"People that actually read the T&C's, what's the weirdest thing you've come across?",0,False,False,1573665125.0,0
What’s a small change/addition you can make to your daily life that makes a big difference?,2,False,False,1573665119.0,1
How do you be a good person?,17,False,False,1573665114.0,1
What is the meme of the year?,4,False,False,1573665114.0,0
Imagine not believing in a God. Can’t relate. Whats it like being a heretic?,12,False,False,1573665111.0,0
"For some weird reason, you control the internet for one single day. Whatever you add or erase will have an impact on the internet forever. What would you do and why?",11,False,False,1573665090.0,0
"Irish people, how do you feel about the fact that the name of your country essentially means ""anger/rage land""? Is it accurate?",2,False,False,1573665066.0,1
"Since it’s almost 2020, what would be the meme of the decade?",10,False,False,1573665048.0,2
Partners of men who have restored/are restoring their foreskins - how has your sex changed?,21,False,True,1573665032.0,1
"Addicts of Reddit, what’s something non-addicts don’t seem to understand?",10,False,False,1573665020.0,5
What song created in the past year will give you extreme nostaliga in a few decades time?,1,False,False,1573665019.0,2
"You've written a movie script and it's being used for a major Hollywood film, what's it about and who does it star?",9,False,False,1573665019.0,0
What’s your awkward elevator story?,4,False,False,1573665015.0,0
What do you do to help someone having a panic attack?,5,False,False,1573665012.0,0
"In your hobby, what is a surprisingly good brand or product in terms of quality but also falls under the budget category of that hobby?",3,False,False,1573665006.0,1
What's something that made you stop and stare?,2,False,False,1573664996.0,1
"Girls who check out other girls, why?",15,False,False,1573664988.0,4
What was one of your exes secrets that you’re now willing to share with the rest of the class?,16,False,False,1573664985.0,2
what is your greatest achievement in life?,3,False,False,1573664982.0,0
"Dear Girls, Which Was The Latest Movie That Made U Cry?",3,False,False,1573664980.0,0
