title,num_comments,spoiler,over_18,created_utc,score
"Guys, in case it were hypothetically possible, in a world where your mother wouldn’t be your mother, would you get married to your mother?",20,False,False,1573664965.0,0
What was the reason or how did you realize that a person you did not liked backed was actually someone special (romantically) to you?,3,False,False,1573664961.0,2
"Italians of Reddit, what are your thoughts about pineapple on Pizza?",8,False,False,1573664960.0,3
"why is Columbus demonized when the Native Americans did the same things as him (slavery, war, brutality)?",30,False,False,1573664956.0,2
What hashtag would you like to present to us and have it go viral?,1,False,False,1573664952.0,1
"Gamer girls of Reddit, what is the creepiest and the sweetest thing that's happened to you in a game?",1,False,False,1573664932.0,3
Whats the funniest thing you ever saw?,0,False,False,1573664926.0,2
What philosophical books contain real profound thinking and are not just word salad?,7,False,False,1573664924.0,3
"If you were to fight yourself, who would win?",18,False,False,1573664913.0,1
You have the ability to revive one TV show you loved and have a successful reboot. The cast has all aged in the time since it was cancelled. What show is it and what happened to them in the time between its cancellation and ressurection to explain why the cast is older?,8,False,False,1573664889.0,2
What is in your junk drawer?,15,False,False,1573664873.0,3
If people in different countries were human animal hybrids what animal would best represent your country why ?,9,False,False,1573664868.0,2
Why are you getting sent to the ranch?,1,False,False,1573664866.0,2
What is an underutilized sub that could be really helpful if more people used it?,3,False,False,1573664855.0,3
"Fellow men of Reddit: Outside of Sex, what do you think your needs in a relationship are?",20,False,True,1573664827.0,2
"Have some of the protests around the globe changed how you value privacy? If so, what have you changed?",5,False,False,1573664818.0,3
"Anime/manga haters, why do you hate them?",6,False,False,1573664804.0,2
"People who met their S/O online, what's the story?",3,False,False,1573664798.0,5
"In recent memory, who has been your state's best Governor? What made him or so great?",7,False,False,1573664781.0,1
"if you were forced to move to another country, what country would you choose?",23,False,False,1573664754.0,3
Gym rats! How far are you willing to travel to go to the gym?,4,False,False,1573664753.0,2
In what ways somebody you have met is completely out of touch with reality?,9,False,False,1573664748.0,2
What is the most annoying (reasonably priced) toy someone can buy for their friend's two year old boy?,9,False,False,1573664733.0,2
Why are clones sexy?,12,False,True,1573664719.0,0
What is your favorite word?,98,False,False,1573664714.0,22
What is something that people don't realize about reality TV?,8,False,False,1573664699.0,3
"What is one thing that one person could do, and if they did it, they would be the first person in history to ever do that one thing?",6,False,False,1573664694.0,3
"Movie enthusiasts of reddit, what is your favorite movie quote?",14,False,False,1573664693.0,3
What do you prefer Coke or Fanta?,12,False,False,1573664691.0,4
What Is Your Favorite Movie Of This Decade?,5,False,False,1573664686.0,3
"Users of Reddit, what would be your first thought when you see a girl checking you out(if that ever happened)?",11,False,False,1573664676.0,1
"What is the most arbitrary rule on a subreddit that prevented you from posting, or got your post removed?",4,False,False,1573664676.0,3
You lose all of your family/baby photos in a house fire. Nothing is backed up digitally and there is no way to directly recover what was burned. What avenues do you take to collect existing photos from your childhood/important life events?,5,False,False,1573664665.0,3
What should be “common curtesy”?,9,False,False,1573664661.0,4
"Dogs of Reddit, who’s a good boy?",23,False,False,1573664660.0,6
People who have had gastric bypass surgery: What has life been like since the surgery?,0,False,False,1573664633.0,2
What if there were smartphones in ww1?,18,False,False,1573664616.0,7
What is your biggest moment of shame in highschool??,1,False,False,1573664607.0,3
(serious) What's the best way to find a job?,12,False,False,1573664603.0,3
"People who think of their life as hell on earth , why?",4,False,False,1573664597.0,6
What are your favourite underrated/unknown video games?,15,False,False,1573664590.0,3
What is the True Meaning of a Human being Life what happens after death do we dissapear like A . Erased never Knowing existence That we Lived on this Planet ?,3,False,False,1573664588.0,0
What do you want as a gift for the holidays this year?,8,False,False,1573664578.0,2
"Non-US citizens, what is your opinion on all the corruption being exposed in our government?",11,False,False,1573664557.0,4
"People of Reddit, how dare you?",22,False,False,1573664556.0,7
"Dear Reddit, what’s a time you cheated on your partner? How’d it turn out?",5,False,False,1573664539.0,3
With the potential impeachment of President Trump how do you guys feel about VP Mike Pence becoming president if the current president actually gets impeached?,27,False,False,1573664531.0,0
It has been 12 years since the first Assassin’s Creed came out. What has been your favorite AC moment?,11,False,False,1573664509.0,5
"If sacrificing your own life would save the lives of a specific number of strangers, how many strangers would need to be saved for you to sacrifice your own life? What if the people were friends? What about family? And why?",23,False,False,1573664497.0,7
What are the most bizarre reasons people fought in your High School?,7,False,False,1573664486.0,3
How many comments are posted on Reddit in a day?,7,False,False,1573664480.0,2
"Chefs of Reddit, what do you cook for yourself when you get home?",3,False,False,1573664473.0,4
"Teachers of Reddit, If your students and/or their parents all took the $10/20/50 they spend on Starbucks cards and the like for you each holiday season, and pooled it for one big gift for you, what would be the best gift they could give?",2,False,False,1573664467.0,4
What joke is funny but very deep?,5,False,False,1573664462.0,2
What’s a genuinely fun job to have?,6,False,False,1573664458.0,5
What you know about Ukraine?,17,False,False,1573664452.0,6
What is a cheap way of having fun that rich people are missing out on?,7,False,False,1573664437.0,3
What's the most savage joke your parent has told about you?,4,False,False,1573664424.0,2
"People of Reddit, how to breakup with someone without hurting their feelings?",9,False,False,1573664418.0,3
"Participants of a Hypnosis show, was it real or were you faking?",8,False,False,1573664407.0,12
What would an accurate horoscope read like for you?,2,False,False,1573664406.0,2
What skill are you proud of?,7,False,False,1573664405.0,3
How do you know if someone is checking you out?,15,False,False,1573664397.0,4
How did asking out your co-worker go?,10,False,False,1573664393.0,2
What is a great and short quote?,23,False,False,1573664381.0,6
What was your best thrift store find?,3,False,False,1573664380.0,3
What are the lengths you've gone to to avoid seeing someone you dislike?,9,False,False,1573664368.0,3
"Girls, when is an appropriate time, and method, for a stranger to come up to you and say they are attracted to you/shoot their shot?",20,False,False,1573664368.0,6
What is your worst quality?,7,False,False,1573664365.0,2
"In what situations is it okay to start a conversation with a stranger, with the idea of possibly asking them out?",4,False,False,1573664363.0,7
Is it normal to feel sad and angry whenever you see a group of friends hanging out and having a good time because you're very lonely and don't have close friends?,6,False,False,1573664358.0,4
What's your weird useless skill??,19,False,False,1573664353.0,3
"what do think is the main reason behind people being confused about ""you're"" and ""your""?",5,False,False,1573664336.0,1
What are some funny lies you heard from a teenager as a kid?,5,False,True,1573664336.0,2
"What irrelevant, yet scandalous facts will come to light during the impeachment trial?",1,False,False,1573664335.0,3
You have Absolute Power. Would you be a King who is loved or feared ?,13,False,False,1573664331.0,2
"Since the 2010s are ending, which meme should be voted the best of the decade?",8,False,False,1573664324.0,4
Antman could have killed Thanos by crawling up his butt. What problems in life can be solved in the same way?,8,False,True,1573664323.0,1
"Guys or girls, what makes a girl ugly to you?",51,False,False,1573664312.0,9
"People of Reddit; if you had to go a whole year only eating TWO foods mixed together, what would you eat to get through it, and why?",11,False,False,1573664308.0,4
(serious) How can someone learn to smile more?,4,False,False,1573664295.0,2
Someone secretly scores you on everything you do. You just got a 10/10 what did you do?,54,False,False,1573664285.0,25
What would you call that shiver you get when you need to pee?,14,False,False,1573664278.0,4
What or who would you like to be reincarnated as?,17,False,False,1573664261.0,6
You get a chance to bring back two species of dinosaurs with the goal of selectively breeding one for work (including military) and one for companionship. You cannot crossbreed. Which dinosaurs do you bring back and what traits do you look for while selectively breeding?,2,False,False,1573664257.0,4
What is the biggest lie you ever got yourself into?,6,False,False,1573664255.0,3
What is the harshest breakup you have been through?,12,False,False,1573664248.0,3
What is your favorite music?,25,False,False,1573664239.0,3
"Adults of Reddit, what is your favorite kids cartoon that seems blatantly adult?",8,False,False,1573664230.0,1
"Don't ask questions, but what is something that stays disgustingly sticky for a very long time but is kinda unnoticeable so someone would be mildly annoyed for a very long time because they keep forgetting it's sticky?",8,False,False,1573664228.0,1
What small relatively cheap thing has improved your life?,15,False,False,1573664211.0,5
What are some gifts no one remembers to gift? What are some of the best gifts you've given/received?,2,False,False,1573664207.0,1
"Girls, question for you, how many creeps you ever met?",10,False,False,1573664202.0,2
What are the best psycological tricks to make people to be on your side?,10,False,False,1573664200.0,0
What is the most awful smell on Earth?,10,False,False,1573663756.0,2
Reddit what would you do on Purge night if it was real?,13,False,False,1573664199.0,2
What’s your favourite word?,10,False,False,1573664193.0,2
"(Serious) There's a quote by Winston Churchill which says ""if you're going through hell, keep going"" , so when was a time where you went through the worst but had to keep going to get through?",8,False,False,1573664193.0,3
"To Those That Are In Their 30s, 40s and up... What Do You Not ""Get"" That Younger Generations Do?",15,False,False,1573664192.0,0
"Guys, what do you actually think when you notice a girl checking you out?",9,False,False,1573664192.0,3
What do you guys think about Trump's Impeachment inquiry? Will he get impeached?,18,False,False,1573664192.0,0
What is the most toxic trait in a romantic partner?,8,False,False,1573664181.0,5
"If you had to tell someone both one SFW and one NSFW fun fact about yourself, what would they be?",5,False,True,1573664179.0,1
"people who lost their phone and a stranger found it, what's your story?",8,False,False,1573664173.0,4
What are your thoughts on forcing the elderly to participate in involuntary unpaid employment organizations?,8,False,False,1573664172.0,0
What’s the worst thing you’ve ever personally witnessed?,4,False,False,1573664164.0,1
"If you'd swap bodies with a person from the other gender, what would be useful information about your genders body/behavior as well as unwritten rules for that gender?",4,False,False,1573664155.0,2
"On average, how often do you cum?",14,False,False,1573664144.0,1
"What are some good meals to cook for people who enjoy cooking, but feel overwhelmed by it?",1,False,False,1573664141.0,2
“There’s so much more to life than love yet the world speaks nothing but of it” what other things are there to life than love?,10,False,False,1573664133.0,4
"Simple question; Where to we put the line between something being “wrong”, “different” and “abnormal”?",7,False,False,1573664132.0,2
What is your favorite day of the year and why?,4,False,False,1573664126.0,1
What would you do if you found a furry costume in your partners house?,8,False,False,1573664123.0,0
What would be a good flirt in Medieval Times?,16,False,False,1573664107.0,3
"(serious) Girls of Reddit, what's the best compliment someone could give you?",12,False,False,1573664106.0,2
What is the weirdest thing you believed as a kid?,45,False,False,1573664104.0,14
"What was your worst attempt at roasting,that ended up backfiring at you?",2,False,False,1573664101.0,3
"How would life be like if Neanderthals, homo erectus, homo habilis etc, still existed on earth?",4,False,False,1573664096.0,4
What would happen if you put the quiet place monster(s) in the the worlds quietest room?,2,False,False,1573664073.0,3
What is the best thing that happened to you by accident?,2,False,False,1573664057.0,3
What food is the hardest to eat?,11,False,False,1573664056.0,3
What is a good sub-reddit to post new ideas and work collaboratively ?,1,False,False,1573664056.0,2
Could WWII of been avoided and how?,12,False,False,1573664055.0,2
What's the best way to deal with depression?,13,False,False,1573664050.0,6
What moment did you have that made you realize the world can actually be really good/nice?,2,False,False,1573664043.0,3
"For people who have had physically injured thereselfs really bad, whats your story?",2,False,False,1573664038.0,3
Do you have the same name as a tv/movie character/actor? How has it affected your life?,0,False,False,1573664038.0,3
Could WWI of been avoided and how?,7,False,False,1573664037.0,1
What makes you feel powerful?,2,False,False,1573664037.0,3
What is that person who peaked in high school doing now?,1,False,False,1573664033.0,2
"Poopers of reddit, what is the worst pooping experience you have ever had?",4,False,True,1573664026.0,3
What Are Your Go-To Truth Or Dare Questions/Actions?,0,False,False,1573664010.0,5
Since the holidays are upon us. When do you put your CHRISTmas tree up?,25,False,False,1573664010.0,1
"SAHMs of Reddit, how much does your husband earn and can you live comfortably on one income? When would you consider going back into the working scene?",7,False,False,1573663998.0,0
What important inventions/things we didn’t noticed even tho they are important?,1,False,False,1573663983.0,3
If you faced yourself in an argument how would you beat them ?,5,False,False,1573663978.0,5
You become the main antagonist in your favorite video game. Who are you and what's the first thing you do?,14,False,False,1573663951.0,3
"Teachers of Reddit, what’s the worst grade you’ve ever had to mark?",2,False,False,1573663893.0,2
[Serious] How would you approach a beautiful stranger in a public place (i.e. the supermarket)? Have you ever managed to get a date or contact info this way?,13,False,False,1573663884.0,2
Weebs of reddit whos your favorite loli and from witch anime/hentai they come frome?,15,False,False,1573663874.0,0
What is the worst movie youve ever seen?,78,False,False,1573663866.0,9
"As we approach the end of a decade going into the 2020’s, what was the meme of the decade?",4,False,False,1573663853.0,1
"If you could send a specialist of any field of knowledge (doctor, physicist, philosopher...) back in time, what kind of specialist would it be and why(Consider that his knowledge will be accepted and our current knowledge in that field would be much more advanced because we would have a headstart)?",5,False,False,1573663843.0,2
What is your favorite memory?,7,False,False,1573663835.0,3
What is the best or most creative comeback you know?,25,False,False,1573663831.0,6
What is the most cringy moment you have witnessed being external to that situation?,0,False,False,1573663830.0,2
What is something that has happened in your life that would fit perfectly into a sitcom?,5,False,False,1573663806.0,3
"Divorced parents of reddit, how was the divorce your child’s fault?",10,False,False,1573663804.0,2
What's the weirdest thing you've masturbated to?,24,False,False,1573663800.0,5
"Where you are, what time is an acceptable 'Beer O'Clock' time?",11,False,False,1573663796.0,3
"Reddit, what is an overused word/phrase on here?",10,False,False,1573663792.0,6
Who Has/Had The Easiest Job In The World?,10,False,False,1573663778.0,6
You find a Stand Arrow while on a trip to a foreign country. What do you do with it?,12,False,False,1573663772.0,0
You're able to make one thought appear in anybody's head once. How do you cause the most trouble?,4,False,False,1573663768.0,2
"People using alt reddit accounts, what are you hiding?",9,False,False,1573663766.0,1
"[SERIOUS] Parents who chose to have children, how did you know you wanted them?",3,False,False,1573663766.0,2
What’s the longest movie you’ve seen (and would recommend)?,17,False,False,1573663752.0,2
"Whats something you thought was ok at one point, then realized how weird it was?",1,False,False,1573663748.0,1
What's the craziest sub posting rule you've ever seen?,0,False,False,1573663737.0,2
(Serious) What are some red flags you look for when it comes to being someone’s friend or not?,6,False,False,1573663724.0,0
Who was the most famous alumni from your school?,6,False,False,1573663721.0,1
How is Yahoo still a thing?,2,False,False,1573663718.0,0
If you had a genie what would your 3 wishes be?,14,False,False,1573663718.0,5
What was the craziest reason you had to end a relationship?,3,False,False,1573663699.0,3
"Girls, what do you look for in a guy?",7,False,False,1573663698.0,3
What is considered impolite in your specific occupation that anyone outside of your industry wouldn't understand?,4,False,False,1573663697.0,2
What screams that you are uneducated?,11,False,False,1573663697.0,3
What are the funniest confessions you've ever heard or read?,0,False,False,1573663690.0,1
What is the best memory you have with your closest friend(s)?,4,False,False,1573663688.0,1
Who inspires you a lot? Who do you aspire to be like?,3,False,False,1573663686.0,1
What do you want to do with your life? Why haven’t you done it?,6,False,False,1573663678.0,5
What is the scariest movie (or documentary) you have ever watched?,9,False,False,1573663648.0,2
If you died and got reincarnated. What / Who would you come back as?,20,False,False,1573663639.0,5
[Serious] What is causing you some stress right now?,64,False,False,1573663624.0,7
Why are some foster parents abusive? What usually leads to foster parents being abusive?,5,False,False,1573663604.0,2
What’s an urban legend from your childhood neighborhood?,10,False,False,1573663602.0,3
Doctors of reddit what is the weirdest thing you have found out someone ate?,3,False,False,1573663601.0,2
Who is spending the day bored on a film set?,7,False,False,1573663598.0,0
We are close to 2020 so what’s the meme of the decade?,18,False,False,1573663588.0,1
What is your favorite of life's simple pleasures?,9,False,False,1573663585.0,0
What's that crazy thing you found in common with your best mate that got you to bond forever?,4,False,False,1573663579.0,0
What do you think to the idea of a dating app connected to a vending machine where you buy a code which gives you access to a local persons inbox/feed?,10,False,False,1573663574.0,0
What seems legal but is actually illegal?,17,False,False,1573663573.0,0
"People of Reddit, what is your ""Nope, I'm not gay"" story?",9,False,False,1573663571.0,0
"You have just gained the ability to save/reload your game, but in real life. How does this change your life?",12,False,False,1573663537.0,3
"[Serious] People of reddit who has up until, now made the biggest impact in your life and why?",3,False,False,1573663533.0,1
"If animals suddenly developed the ability to talk, what would some of them say?",12,False,False,1573663533.0,2
What was your first kiss like? Has it ever felt like that first time since?,10,False,False,1573663528.0,3
What’s your favorite “But everything is _____”?,9,False,False,1573663522.0,4
"If you could eat only 3 foods for the rest of your life, what would they be?",8,False,False,1573663517.0,3
"Are you living your dream? If not, what was your dream and what steered you off course?",1,False,False,1573663514.0,3
What are your best tips to overcome the depression that comes with winter?,9,False,False,1573663505.0,3
What time did you wake up this morning?,21,False,False,1573663476.0,3
If you could have any kind of freak accident happen to you (the kind that gives you powers) what would the accident be and what powers would you gain?,6,False,False,1573663474.0,2
For 150k people to read: What do you think about John 3:16?,6,False,False,1573663473.0,0
What interesting fact did you learn today?,4,False,False,1573663461.0,1
Whats it really like being white?,32,False,False,1573663459.0,0
How are you doing today?,23,False,False,1573663450.0,1
Is there someone who was so important to history but didn't get enough credit for it?,3,False,False,1573663447.0,1
"People who married their high school sweetheart, when did you know they were the one?",3,False,False,1573663435.0,1
"What do friends and family expect for free, just because of your line of work?",9,False,False,1573663434.0,0
"What topping, that usually isn't found on pizza, would taste the best?",14,False,False,1573663428.0,3
What’s the worst feeling in the world?,9,False,False,1573663423.0,1
"Moms of reddit, what was the weirdest food craving you had while pregnant? What ended up being the best or the worst?",7,False,False,1573663417.0,1
"People who like listening to music, what is the best music?",13,False,False,1573663408.0,2
What is the best way to clean a guitar neck?,6,False,False,1573663382.0,1
"From super depressed, to super happy. What's your story?",7,False,False,1573663381.0,3
What is something you forced to like it your whole life?,4,False,False,1573663379.0,2
"How do you improve your self confidence? If you feel like you have very little to offer or that you consistently fail, how improve your own self image?",9,False,False,1573663374.0,0
Would you say there’s more good or evil in the world ? Why?,8,False,False,1573663367.0,3
"Girls, what do you notice about guys if/when you check them out??",12,False,False,1573663363.0,2
"If life was a video game, what would be our bugs and glitches?",14,False,False,1573663356.0,5
"What would be the reason someone is sleepy all the time and when they wake up, they have to throw up?",14,False,False,1573663353.0,2
What are the most number of awards a post can get?,2,False,False,1573663349.0,0
"Females of Reddit, what is the best way to ask someone out?",12,False,False,1573663332.0,2
What’s the most dumb thing you tried that actually worked?,2,False,False,1573663332.0,1
What are things that happen in apocalyptic books/ movies that make no sense to you?,9,False,False,1573663323.0,0
What would a meme look like in the 1700's if everyone had access to the internet?,3,False,False,1573663311.0,2
What's your comfort zone?,5,False,False,1573663302.0,3
You are forced to delete all the apps from your phone except for one. Which app are you leaving?,19,False,False,1573663295.0,1
What is taboo in your culture yet completely ridiculous that it is ?,9,False,False,1573663287.0,2
What's the heaviest secret you've had to keep?,3,False,False,1573663271.0,2
Whats one of your secret?,6,False,False,1573663262.0,2
Whats a suprisingly harmless task for name its given?,5,False,True,1573663252.0,2
"People who liked the original movie Sonic design more than the remade one, why?",4,False,False,1573663249.0,1
"Girls, what can a guy do to make his (solicited) dick pics more exciting?",9,False,True,1573663242.0,3
What conspiracy theories are you convinced are true?,11,False,False,1573663233.0,3
What do you think of those perfect lips and teeth in lipstick ads/commercials and why (plus m or f?)?,0,False,False,1573663227.0,1
What is something you consider to be a masterpiece?,9,False,False,1573663221.0,2
What’s the worst thing your parent(s) said to you?,14,False,False,1573663217.0,2
What is something you believe but can’t prove?,12,False,False,1573663213.0,4
"If you could have the powers (and limitations) of any Marvel or DC superhero/villain, which power set would you choose and why?",5,False,False,1573663210.0,2
"People who have had feuds with their neighbors, what was the issue?",1,False,False,1573663209.0,2
How did you discover what you want to do with your life?,15,False,False,1573663200.0,4
What's the most surprising edit or update you've seen on a post?,0,False,False,1573663190.0,3
What are some of the offbeat android games like A Dark Room?,1,False,False,1573663185.0,2
"Redditors, what's a well-known fact that you recently found out?",4,False,False,1573663183.0,1
How’d you feel if you wished your partner good luck in their tennis match and they left you on read till the next day?,3,False,False,1573663180.0,0
"What type of nose-beard would you wear, if very hairy noses were normal?",9,False,False,1573663173.0,4
How can AskReddit answers sample bias be resolved?,1,False,False,1573663166.0,2
When does President Trump testify before Congress during the impeachment hearings?,7,False,False,1573663161.0,3
What is the best why to clean the neck of a electric guitar at school?,7,False,False,1573663153.0,1
How do you stay motivated?,2,False,False,1573663147.0,5
[NSFW] What's your embarrassing naked story?,12,False,True,1573663140.0,11
